<?xml version="1.0" encoding="utf-8" standalone="no"?>
<!DOCTYPE deviceDefinitions SYSTEM "deviceDefinitions.dtd">

<deviceDefinitions name="PIC18F8520" rev="B" type="8-bit MCU" family="GP">

<!-- needs finishing volt and temp -->
<operatingTemperature>
	<temperature minmax="-40 degC, +85 degC">
		<voltage minmax="2.5V, 5.5V"><frequency minmax="0 MHz, 25 MHz"></frequency></voltage>
		<voltage minmax="4.5V, 5.5V"><frequency minmax="0 MHz, 25 MHz"></frequency></voltage>
	</temperature>
	<temperature minmax="-40 degC, +125 degC">
		<voltage minmax="4.5V, 5.5V"><frequency minmax="0 MHz, 25 MHz"></frequency></voltage>
	</temperature>
</operatingTemperature>

<memory RAM="2048" programFLASH="32768" EEPROM="1024"></memory>

<resources>
	<pinDefinitions name="PIC18/PIC18Fxx20 80-Pin TQFP PinsDefinitions"></pinDefinitions>
	<interrupts name="PIC18/PIC18F8720 Interrupts" IVTStart="" AIVTStart="" SFRAddressSize=""></interrupts>
	<configurationRegisters name="PIC18/PIC18Fxx20 ConfigurationRegisters"></configurationRegisters>
</resources>

<packageList>
	<type name="80-Pin TQFP"></type>
</packageList>

<codeTemplate name="PIC18/PIC18F8720 CodeTemplate"></codeTemplate>

<errata name="*80157*"></errata>
<dataSheet name="*39609*"></dataSheet>
<programRef name="PIC18Fxx20 ProgrammersReferenceManual"></programRef>
<familyRef name="PIC18Fxx20 FamilyReferenceManual"></familyRef>

<features type="required">
	<group name="integration" type="integration" caption="integration">
		<feature name="Oscillator1" oldinstance="1" caption="Oscillator" file="PIC18/Oscillator1" feature="Oscillator1" image="oscillator"></feature>
	</group>
    <group name="integration" type="integration" caption="integration">
      <feature name="Interrupts18" caption="Interrupts and Traps" file="PIC18/Interrupts1" feature="Interrupts18" image="Interrupts"/>
    </group>
</features>
<features type="optional">
	<group name="RTC" type="RTC" caption="RTC">
		<feature name="RTC" oldinstance="1" caption="RTC" file="PIC18/RTC" feature="Timer1" image="RTC"></feature>
	</group>
	<group name="IOPort" type="IOPort" caption="I/O Ports">
		<feature name="IOPort" instance="A" caption="Port A" file="PIC18/IOPort" feature="IOPortA" image="IOPort"></feature>
		<feature name="IOPort" instance="B" caption="Port B" file="PIC18/IOPort" feature="IOPortB" image="IOPort"></feature>
		<feature name="IOPort" instance="C" caption="Port C" file="PIC18/IOPort" feature="IOPortC" image="IOPort"></feature>
		<feature name="IOPort" instance="D" caption="Port D" file="PIC18/IOPort" feature="IOPortD" image="IOPort"></feature>
		<feature name="IOPort" instance="E" caption="Port E" file="PIC18/IOPort" feature="IOPortE" image="IOPort"></feature>
		<feature name="IOPort" instance="F" caption="Port F" file="PIC18/IOPort" feature="IOPortF" image="IOPort"></feature>
		<feature name="IOPort" instance="G" caption="Port G" file="PIC18/IOPort" feature="IOPortG" image="IOPort"></feature>
		<feature name="IOPort" instance="H" caption="Port H" file="PIC18/IOPort" feature="IOPortH" image="IOPort"></feature>
		<feature name="IOPort" instance="J" caption="Port J" file="PIC18/IOPort" feature="IOPortJ" image="IOPort"></feature>
	</group>
	<group name="timer" type="Timers" caption="Timers">
		<feature name="16bitZeroTimer" instance="0" caption="16-bit Timer 0" file="PIC18/16bitZeroTimer" feature="Timer0" image="TimerR"></feature>
		<feature name="16bitTimer" instance="1" caption="16-bit Timer 1" file="PIC18/16bitTimer" feature="Timer1" image="TimerR"></feature>
		<feature name="16bitTimer" instance="3" caption="16-bit Timer 3" file="PIC18/16bitTimer" feature="Timer3" image="TimerR"></feature>
		<feature name="8bitZeroTimer" instance="0" caption="8-bit Timer 0" file="PIC18/8bitZeroTimer" feature="Timer0" image="TimerR"></feature>
		<feature name="8bitTimer" instance="2" caption="8-bit Timer 2" file="PIC18/8bitTimer" feature="Timer2" image="TimerR"></feature>
		<feature name="8bitTimer" instance="4" caption="8-bit Timer 4" file="PIC18/8bitTimer" feature="Timer4" image="TimerR"></feature>
	</group>
	<group name="counter" type="Counters" caption="Counters">
		<feature name="16bitZeroCounter" instance="0" caption="16-bit Counter 0" file="PIC18/16bitZeroCounter" feature="counter0" image="Counter"></feature>
		<feature name="16bitAsyncCounter" instance="1" caption="Async Counter 1" file="PIC18/16bitAsyncCounter" feature="counter1" image="Counter"></feature>
		<feature name="16bitSyncCounter" instance="1" caption="Sync Counter 1" file="PIC18/16bitSyncCounter" feature="counter1" image="Counter"></feature>
		<feature name="16bitAsyncCounter" instance="3" caption="Async Counter 3" file="PIC18/16bitAsyncCounter" feature="counter3" image="Counter"></feature>
		<feature name="16bitSyncCounter" instance="3" caption="Sync Counter 3" file="PIC18/16bitSyncCounter" feature="counter3" image="Counter"></feature>
		<feature name="8bitZeroCounter" instance="0" caption="8-bit Counter 0" file="PIC18/8bitZeroCounter" feature="counter0" image="Counter"></feature>
	</group>
	<group name="IC" type="IC" caption="IC">
		<feature name="CCPIC" instance="1" caption="IC 1" file="PIC18/IC" feature="CCPIC1" image="Capture"></feature>
		<feature name="CCPIC" instance="2" caption="IC 2" file="PIC18/IC" feature="CCPIC2" image="Capture"></feature>
		<feature name="CCPIC" instance="3" caption="IC 3" file="PIC18/IC" feature="CCPIC3" image="Capture"></feature>
		<feature name="CCPIC" instance="4" caption="IC 4" file="PIC18/IC" feature="CCPIC4" image="Capture"></feature>
		<feature name="CCPIC" instance="5" caption="IC 5" file="PIC18/IC" feature="CCPIC5" image="Capture"></feature>
	</group>
	<group name="OC" type="OC" caption="OC">
		<feature name="CCPOC" instance="1" caption="OC 1" file="PIC18/OC" feature="CCPOC1" image="Compare"></feature>
		<feature name="CCPOC" instance="2" caption="OC 2" file="PIC18/OC" feature="CCPOC2" image="Compare"></feature>
		<feature name="CCPOC" instance="3" caption="OC 3" file="PIC18/OC" feature="CCPOC3" image="Compare"></feature>
		<feature name="CCPOC" instance="4" caption="OC 4" file="PIC18/OC" feature="CCPOC4" image="Compare"></feature>
		<feature name="CCPOC" instance="5" caption="OC 5" file="PIC18/OC" feature="CCPOC4" image="Compare"></feature>
		<feature name="Comparator" instance="1" caption="Comparator" file="PIC18/Comparator" feature="Comparator" image="Compare"></feature>
		<feature name="VoltageRef" instance="1" caption="Cmp Voltage Reference" file="PIC18/VoltageRef" feature="VoltageRef" image="Compare"></feature>
	</group>
	<group name="PWM" type="PWM" caption="PWM">
		<feature name="CCPPWM" instance="1" caption="PWM" file="PIC18/PWM" feature="PWM1" image="PWM"></feature>
		<feature name="CCPPWM2" oldinstance="1" caption="PWM" file="PIC18/PWM2" feature="PWM2" image="PWM"></feature>
		<feature name="CCPPWM" instance="3" caption="PWM" file="PIC18/PWM" feature="PWM3" image="PWM"></feature>
		<feature name="CCPPWM" instance="4" caption="PWM" file="PIC18/PWM" feature="PWM4" image="PWM"></feature>
		<feature name="CCPPWM" instance="5" caption="PWM" file="PIC18/PWM" feature="PWM5" image="PWM"></feature>
	</group>
	<group name="SPI" type="SPI" caption="SPI">
		<feature name="SPI" instance="1" caption="SPI 1" file="PIC18/SPI" feature="SPI1" image="SPI"></feature>
	</group>
	<group name="I2C" type="I2C" caption="I2C">
		<feature name="I2C" oldinstance="1" caption="I2C" file="PIC18/I2C" feature="I2C" image="I2C"></feature>
	</group>
	<group name="UART" type="UART" caption="UART">
		<feature name="UART" instance="1" caption="UART 1" file="PIC18/UART" feature="UART1" image="UART"></feature>
		<feature name="UART" instance="2" caption="UART 2" file="PIC18/UART" feature="UART2" image="UART"></feature>
		<feature name="USART" instance="1" caption="USART 1" file="PIC18/USART" feature="USART1" image="UART"></feature>
		<feature name="USART" instance="2" caption="USART 2" file="PIC18/USART" feature="USART2" image="UART"></feature>
	</group>
	<group name="A2D" type="A2D" caption="A to D">
		<feature name="A2D10bit" oldinstance="1" caption="10-bit A to D" file="PIC18/A2D10bit16ch" feature="A2D10bit" image="ADC"></feature>
	</group>
	<group name="reset" type="Reset" caption="Reset"> <!-- temp -->
		<feature name="BOR" oldinstance="1" caption="Reset" file="PIC18/BOR" feature="BOR" image="Brownout"></feature>
		<feature name="LVD" oldinstance="1" caption="LVD" file="PIC18/LVD" feature="LVD" image="LVD"></feature>
		<feature name="WDT" oldinstance="1" caption="WDT" file="PIC18/WDT" feature="WDT" image="WDT"></feature>
	</group>
	<group name="EMI" type="EMI" caption="DMI">
		<feature name="EMI" oldinstance="1" caption="EMI" file="PIC18/EMI" feature="EMI" image="EMI"></feature>
		<feature name="PSP" oldinstance="1" caption="PSP" file="PIC18/PSP" feature="PSP" image="PSP"></feature>
	</group>
</features>

</deviceDefinitions>
